{
  "$schema": "https://json-schema.org/draft/2020-12/schema",
  "$id": "https://pcs.sentinelops.ci/schemas/BenchmarkRun.v0.schema.json",
  "title": "BenchmarkRun.v0",
  "type": "object",
  "required": [
    "schema_version",
    "run_id",
    "task_id",
    "case_id",
    "started_at",
    "completed_at",
    "commands",
    "artifacts_produced",
    "observed_status",
    "observed_failure_code",
    "observed_responsible_component",
    "observed_repair_hint",
    "duration_ms",
    "source_repo",
    "source_commit",
    "signature_or_digest"
  ],
  "additionalProperties": false,
  "properties": {
    "schema_version": { "$ref": "common.defs.json#/$defs/schema_version" },
    "run_id": { "type": "string", "minLength": 1 },
    "task_id": { "type": "string", "minLength": 1 },
    "case_id": { "type": "string", "minLength": 1 },
    "started_at": { "$ref": "common.defs.json#/$defs/iso8601_datetime" },
    "completed_at": { "$ref": "common.defs.json#/$defs/iso8601_datetime" },
    "commands": {
      "type": "array",
      "items": { "$ref": "common.defs.json#/$defs/benchmark_command_entry" }
    },
    "artifacts_produced": {
      "type": "array",
      "items": { "type": "string", "minLength": 1 }
    },
    "observed_status": { "$ref": "common.defs.json#/$defs/benchmark_observed_status" },
    "observed_failure_code": { "type": "string" },
    "observed_responsible_component": {
      "$ref": "common.defs.json#/$defs/benchmark_responsible_component"
    },
    "observed_repair_hint": { "type": "string" },
    "duration_ms": { "type": "integer", "minimum": 0 },
    "source_repo": { "type": "string", "format": "uri" },
    "source_commit": { "$ref": "common.defs.json#/$defs/git_commit" },
    "signature_or_digest": { "$ref": "common.defs.json#/$defs/hex_digest" }
  }
}
