{
  "schema_version": "v0",
  "run_id": "bench-run-valid-scientific-memory-import",
  "task_id": "scientific-memory-rendering-v0",
  "case_id": "valid-scientific-memory-import",
  "started_at": "2026-05-20T10:41:34Z",
  "completed_at": "2026-05-20T10:41:34Z",
  "commands": [
    {
      "command": "validate_release_chain examples/labtrust-release",
      "exit_code": 0
    }
  ],
  "artifacts_produced": [
    "scientific_memory_import_report.json"
  ],
  "observed_status": "passed",
  "observed_failure_code": "",
  "observed_responsible_component": "scientific_memory",
  "observed_repair_hint": "fix_import_report",
  "duration_ms": 82,
  "source_repo": "https://github.com/SentinelOps-CI/pcs-core",
  "source_commit": "d444444444444444444444444444444444444444",
  "signature_or_digest": "sha256:6f4ea2d2408524f32753428fe439577e9195541b2c4332dd1beb1d7757d44201"
}
