{
  "schema_version": "v0",
  "run_id": "bench-run-valid-release-chain",
  "task_id": "labtrust-qc-release-v0",
  "case_id": "valid-release-chain",
  "started_at": "2026-05-20T10:41:34Z",
  "completed_at": "2026-05-20T10:41:34Z",
  "commands": [
    {
      "command": "validate_release_chain examples/labtrust-release",
      "exit_code": 0
    }
  ],
  "artifacts_produced": [],
  "observed_status": "passed",
  "observed_failure_code": "",
  "observed_responsible_component": "unknown",
  "observed_repair_hint": "unknown",
  "duration_ms": 79,
  "source_repo": "https://github.com/SentinelOps-CI/pcs-core",
  "source_commit": "d444444444444444444444444444444444444444",
  "signature_or_digest": "sha256:2d58bc5703133727a8cd8fe9856d1265beb1864101ffbacb6ef393c630e2c6d4"
}
